{"actor_expected":false,"actor_lifecycle":{"cleanup":false,"create":false,"terminal":false},"actor_observed":false,"attempt_id":"attempt-candidate-3","attempt_status":"succeeded","benchmark_id":"p2.17-release-replay","condition_role":"candidate","detail":null,"evidence":["attempts/attempt-candidate-3/mechanism-observation.json"],"exposure":"not-applicable","log_scan_path":null,"predicate":"synthetic attempt terminal exists","qualifiers":[],"reason":"mechanism-not-applicable","schema_version":1,"source_path":null,"source_sha256":null,"source_state":"not-applicable","status":"not-applicable","valid":true}
